2025-11-12 07:53:15.853847 IP6 ::1.57321 > ::1.19080: Flags [S], seq 2923548415, win 65535, options [mss 16324,nop,wscale 6,nop,nop,TS val 2865653866 ecr 0,sackOK,eol], length 0
2025-11-12 07:53:15.853902 IP6 ::1.19080 > ::1.57321: Flags [R.], seq 0, ack 2923548416, win 0, length 0
2025-11-12 07:53:15.854008 IP 127.0.0.1.57322 > 127.0.0.1.19080: Flags [S], seq 3140473693, win 65535, options [mss 16344,nop,wscale 6,nop,nop,TS val 2802439601 ecr 0,sackOK,eol], length 0
2025-11-12 07:53:15.854115 IP 127.0.0.1.19080 > 127.0.0.1.57322: Flags [S.], seq 1438591203, ack 3140473694, win 65535, options [mss 16344,nop,wscale 6,nop,nop,TS val 237961402 ecr 2802439601,sackOK,eol], length 0
2025-11-12 07:53:15.854147 IP 127.0.0.1.57322 > 127.0.0.1.19080: Flags [.], ack 1, win 6380, options [nop,nop,TS val 2802439601 ecr 237961402], length 0
2025-11-12 07:53:15.854171 IP 127.0.0.1.19080 > 127.0.0.1.57322: Flags [.], ack 1, win 6380, options [nop,nop,TS val 237961402 ecr 2802439601], length 0
2025-11-12 07:53:15.854175 IP 127.0.0.1.57322 > 127.0.0.1.19080: Flags [P.], seq 1:117, ack 1, win 6380, options [nop,nop,TS val 2802439601 ecr 237961402], length 116
2025-11-12 07:53:15.854192 IP 127.0.0.1.19080 > 127.0.0.1.57322: Flags [.], ack 117, win 6379, options [nop,nop,TS val 237961402 ecr 2802439601], length 0
2025-11-12 07:53:15.856378 IP 127.0.0.1.57323 > 127.0.0.1.9080: Flags [S], seq 1505266225, win 65535, options [mss 16344,nop,wscale 6,nop,nop,TS val 1104404512 ecr 0,sackOK,eol], length 0
2025-11-12 07:53:15.856476 IP 127.0.0.1.9080 > 127.0.0.1.57323: Flags [S.], seq 4003477127, ack 1505266226, win 65535, options [mss 16344,nop,wscale 6,nop,nop,TS val 3312849190 ecr 1104404512,sackOK,eol], length 0
2025-11-12 07:53:15.856505 IP 127.0.0.1.57323 > 127.0.0.1.9080: Flags [.], ack 1, win 6380, options [nop,nop,TS val 1104404512 ecr 3312849190], length 0
2025-11-12 07:53:15.856522 IP 127.0.0.1.9080 > 127.0.0.1.57323: Flags [.], ack 1, win 6380, options [nop,nop,TS val 3312849190 ecr 1104404512], length 0
2025-11-12 07:53:15.856529 IP 127.0.0.1.57323 > 127.0.0.1.9080: Flags [P.], seq 1:117, ack 1, win 6380, options [nop,nop,TS val 1104404512 ecr 3312849190], length 116
2025-11-12 07:53:15.856542 IP 127.0.0.1.9080 > 127.0.0.1.57323: Flags [.], ack 117, win 6379, options [nop,nop,TS val 3312849190 ecr 1104404512], length 0
2025-11-12 07:53:16.607407 IP6 ::1.57230 > ::1.9080: Flags [R.], seq 4257931790, ack 2260398560, win 6372, length 0
2025-11-12 07:53:30.858512 IP 127.0.0.1.9080 > 127.0.0.1.57323: Flags [.], ack 117, win 6377, length 0
2025-11-12 07:53:30.858595 IP 127.0.0.1.57323 > 127.0.0.1.9080: Flags [.], ack 1, win 6380, options [nop,nop,TS val 1104419513 ecr 3312849190], length 0
2025-11-12 07:53:45.952429 IP 127.0.0.1.9080 > 127.0.0.1.57323: Flags [.], ack 117, win 6377, length 0
2025-11-12 07:53:45.952516 IP 127.0.0.1.57323 > 127.0.0.1.9080: Flags [.], ack 1, win 6380, options [nop,nop,TS val 1104434607 ecr 3312849190], length 0
2025-11-12 07:54:00.964040 IP 127.0.0.1.9080 > 127.0.0.1.57323: Flags [.], ack 117, win 6377, length 0
2025-11-12 07:54:00.964119 IP 127.0.0.1.57323 > 127.0.0.1.9080: Flags [.], ack 1, win 6380, options [nop,nop,TS val 1104449618 ecr 3312849190], length 0
2025-11-12 07:54:15.876086 IP 127.0.0.1.57322 > 127.0.0.1.19080: Flags [.], ack 1, win 6379, length 0
2025-11-12 07:54:15.876134 IP 127.0.0.1.19080 > 127.0.0.1.57322: Flags [.], ack 117, win 6379, options [nop,nop,TS val 238021423 ecr 2802439601], length 0
2025-11-12 07:54:15.965266 IP 127.0.0.1.9080 > 127.0.0.1.57323: Flags [.], ack 117, win 6377, length 0
2025-11-12 07:54:15.965333 IP 127.0.0.1.57323 > 127.0.0.1.9080: Flags [.], ack 1, win 6380, options [nop,nop,TS val 1104464619 ecr 3312849190], length 0
2025-11-12 07:54:31.055970 IP 127.0.0.1.9080 > 127.0.0.1.57323: Flags [.], ack 117, win 6377, length 0
2025-11-12 07:54:31.056004 IP 127.0.0.1.57323 > 127.0.0.1.9080: Flags [.], ack 1, win 6380, options [nop,nop,TS val 1104479710 ecr 3312849190], length 0
2025-11-12 07:54:46.080116 IP 127.0.0.1.9080 > 127.0.0.1.57323: Flags [.], ack 117, win 6377, length 0
2025-11-12 07:54:46.080159 IP 127.0.0.1.57323 > 127.0.0.1.9080: Flags [.], ack 1, win 6380, options [nop,nop,TS val 1104494734 ecr 3312849190], length 0
2025-11-12 07:55:01.336486 IP 127.0.0.1.9080 > 127.0.0.1.57323: Flags [.], ack 117, win 6377, length 0
2025-11-12 07:55:01.336550 IP 127.0.0.1.57323 > 127.0.0.1.9080: Flags [.], ack 1, win 6380, options [nop,nop,TS val 1104509990 ecr 3312849190], length 0
2025-11-12 07:55:15.068605 IP 127.0.0.1.57322 > 127.0.0.1.19080: Flags [F.], seq 117, ack 1, win 6380, options [nop,nop,TS val 2802558814 ecr 238021423], length 0
2025-11-12 07:55:15.068672 IP 127.0.0.1.19080 > 127.0.0.1.57322: Flags [.], ack 118, win 6379, options [nop,nop,TS val 238080615 ecr 2802558814], length 0
2025-11-12 07:55:15.069476 IP 127.0.0.1.57323 > 127.0.0.1.9080: Flags [F.], seq 117, ack 1, win 6380, options [nop,nop,TS val 1104523723 ecr 3312849190], length 0
2025-11-12 07:55:15.069529 IP 127.0.0.1.9080 > 127.0.0.1.57323: Flags [.], ack 118, win 6379, options [nop,nop,TS val 3312968401 ecr 1104523723], length 0
2025-11-12 07:55:15.570776 IP 127.0.0.1.19080 > 127.0.0.1.57322: Flags [F.], seq 1, ack 118, win 6379, options [nop,nop,TS val 238081117 ecr 2802558814], length 0
2025-11-12 07:55:15.570870 IP 127.0.0.1.57322 > 127.0.0.1.19080: Flags [.], ack 2, win 6380, options [nop,nop,TS val 2802559316 ecr 238081117], length 0
2025-11-12 07:55:22.864187 IP 127.0.0.1.9080 > 127.0.0.1.57323: Flags [R.], seq 1, ack 118, win 6379, length 0
