2025-11-12 07:49:39.585577 IP 127.0.0.1.57130 > 127.0.0.1.9080: Flags [S], seq 509084796, win 65535, options [mss 16344,nop,wscale 6,nop,nop,TS val 2901534564 ecr 0,sackOK,eol], length 0
2025-11-12 07:49:39.585653 IP 127.0.0.1.9080 > 127.0.0.1.57130: Flags [S.], seq 1129170824, ack 509084797, win 65535, options [mss 16344,nop,wscale 6,nop,nop,TS val 3642475076 ecr 2901534564,sackOK,eol], length 0
2025-11-12 07:49:39.585674 IP 127.0.0.1.57130 > 127.0.0.1.9080: Flags [.], ack 1, win 6380, options [nop,nop,TS val 2901534564 ecr 3642475076], length 0
2025-11-12 07:49:39.585688 IP 127.0.0.1.9080 > 127.0.0.1.57130: Flags [.], ack 1, win 6380, options [nop,nop,TS val 3642475076 ecr 2901534564], length 0
2025-11-12 07:49:39.585719 IP 127.0.0.1.57130 > 127.0.0.1.9080: Flags [P.], seq 1:116, ack 1, win 6380, options [nop,nop,TS val 2901534564 ecr 3642475076], length 115
2025-11-12 07:49:39.585739 IP 127.0.0.1.9080 > 127.0.0.1.57130: Flags [.], ack 116, win 6379, options [nop,nop,TS val 3642475076 ecr 2901534564], length 0
2025-11-12 07:49:54.585780 IP 127.0.0.1.9080 > 127.0.0.1.57130: Flags [.], ack 116, win 6377, length 0
2025-11-12 07:49:54.585826 IP 127.0.0.1.57130 > 127.0.0.1.9080: Flags [.], ack 1, win 6380, options [nop,nop,TS val 2901549564 ecr 3642475076], length 0
2025-11-12 07:50:09.586791 IP 127.0.0.1.9080 > 127.0.0.1.57130: Flags [.], ack 116, win 6377, length 0
2025-11-12 07:50:09.586846 IP 127.0.0.1.57130 > 127.0.0.1.9080: Flags [.], ack 1, win 6380, options [nop,nop,TS val 2901564566 ecr 3642475076], length 0
2025-11-12 07:50:24.658905 IP 127.0.0.1.9080 > 127.0.0.1.57130: Flags [.], ack 116, win 6377, length 0
2025-11-12 07:50:24.658983 IP 127.0.0.1.57130 > 127.0.0.1.9080: Flags [.], ack 1, win 6380, options [nop,nop,TS val 2901579638 ecr 3642475076], length 0
2025-11-12 07:50:39.717213 IP 127.0.0.1.9080 > 127.0.0.1.57130: Flags [.], ack 116, win 6377, length 0
2025-11-12 07:50:39.717283 IP 127.0.0.1.57130 > 127.0.0.1.9080: Flags [.], ack 1, win 6380, options [nop,nop,TS val 2901594696 ecr 3642475076], length 0
2025-11-12 07:50:54.785014 IP 127.0.0.1.9080 > 127.0.0.1.57130: Flags [.], ack 116, win 6377, length 0
2025-11-12 07:50:54.785059 IP 127.0.0.1.57130 > 127.0.0.1.9080: Flags [.], ack 1, win 6380, options [nop,nop,TS val 2901609764 ecr 3642475076], length 0
2025-11-12 07:51:09.785417 IP 127.0.0.1.9080 > 127.0.0.1.57130: Flags [.], ack 116, win 6377, length 0
2025-11-12 07:51:09.785475 IP 127.0.0.1.57130 > 127.0.0.1.9080: Flags [.], ack 1, win 6380, options [nop,nop,TS val 2901624765 ecr 3642475076], length 0
2025-11-12 07:51:25.050576 IP 127.0.0.1.9080 > 127.0.0.1.57130: Flags [.], ack 116, win 6377, length 0
2025-11-12 07:51:25.050661 IP 127.0.0.1.57130 > 127.0.0.1.9080: Flags [.], ack 1, win 6380, options [nop,nop,TS val 2901639936 ecr 3642475076], length 0
2025-11-12 07:51:38.844951 IP 127.0.0.1.57130 > 127.0.0.1.9080: Flags [F.], seq 116, ack 1, win 6380, options [nop,nop,TS val 2901653730 ecr 3642475076], length 0
2025-11-12 07:51:38.845043 IP 127.0.0.1.9080 > 127.0.0.1.57130: Flags [.], ack 117, win 6379, options [nop,nop,TS val 3642594243 ecr 2901653730], length 0
2025-11-12 07:51:46.600728 IP6 ::1.57230 > ::1.9080: Flags [S], seq 4257931673, win 65535, options [mss 16324,nop,wscale 6,nop,nop,TS val 2453285991 ecr 0,sackOK,eol], length 0
2025-11-12 07:51:46.600857 IP6 ::1.9080 > ::1.57230: Flags [S.], seq 2260398559, ack 4257931674, win 65535, options [mss 16324,nop,wscale 6,nop,nop,TS val 1826039174 ecr 2453285991,sackOK,eol], length 0
2025-11-12 07:51:46.600892 IP6 ::1.57230 > ::1.9080: Flags [.], ack 1, win 6372, options [nop,nop,TS val 2453285991 ecr 1826039174], length 0
2025-11-12 07:51:46.600917 IP6 ::1.9080 > ::1.57230: Flags [.], ack 1, win 6372, options [nop,nop,TS val 1826039174 ecr 2453285991], length 0
2025-11-12 07:51:46.600921 IP6 ::1.57230 > ::1.9080: Flags [P.], seq 1:116, ack 1, win 6372, options [nop,nop,TS val 2453285991 ecr 1826039174], length 115
2025-11-12 07:51:46.600939 IP6 ::1.9080 > ::1.57230: Flags [.], ack 116, win 6371, options [nop,nop,TS val 1826039174 ecr 2453285991], length 0
2025-11-12 07:51:46.683748 IP 127.0.0.1.9080 > 127.0.0.1.57130: Flags [R.], seq 1, ack 117, win 6379, length 0
2025-11-12 07:52:01.602686 IP6 ::1.9080 > ::1.57230: Flags [.], ack 116, win 6370, length 0
2025-11-12 07:52:01.602760 IP6 ::1.57230 > ::1.9080: Flags [.], ack 1, win 6372, options [nop,nop,TS val 2453300993 ecr 1826039174], length 0
2025-11-12 07:52:16.604366 IP6 ::1.57230 > ::1.9080: Flags [F.], seq 116, ack 1, win 6372, options [nop,nop,TS val 2453315994 ecr 1826039174], length 0
2025-11-12 07:52:16.604444 IP6 ::1.9080 > ::1.57230: Flags [.], ack 117, win 6371, options [nop,nop,TS val 1826069177 ecr 2453315994], length 0
